titles,category
     개표조작 불가  선관위 헛말  민주당 대역 음모냐 선거제 바꿔야 할수도 ,Politics
한국인 여행객    명 귀국  현지 공항에 사람 몰려 ,Politics
일본 원전 오염수 방류에 분노한 시민  국민의힘 시의원에  친일파 놈들아  책임져라  일갈,Politics
군 가혹행위    명 입건됐는데 실형은  명   명 중  명은 해군,Politics
박민식  정율성 기념사업 즉각 중단 안하면 시정명령 발동  종합 ,Politics
국회 교육위   김건희 논문 표절  증인 불출석에 감사 일시 중단,Politics
 자객 공천론  하태경   마포을 정청래 잡으란 얘기 많아 ,Politics
 미니총선  두 자릿수 득표차땐  여야 당 대표 둘 중 하나는  치명상 ,Politics
국힘  민주당 정권  선관위 해킹  방치 발본색원해야 ,Politics
이스라엘서 돌아온 여행객들  무사귀국 다행  교민들은 무서워서 집 밖 못 나와 ,Politics
민주당  법무부  인사정보관리단 검증 부실  한동훈  판단은 대통령실 ,Politics
강서구청장 선거    데이    여야 투표율 촉각,Politics
국방장관  대화력전 전면 재검토 단시간 내   장사정포 궤멸시켜야 ,Politics
   신원식 유인촌 임명장 수여  김행은 여전히 고심 중,Politics
민주당  마리 앙투아네트  빵 대신 케이크 상황 오버랩    대통령 순방 예산 증가 비판,Politics
 무등의 아침  이준석  보궐선거는   정부  년 차 평가 김태우 후보 당선보다 득표율이 관심 ,Politics
진성준  강서 지면 여야 지도부 책임져야 김기현도 같은 처지 ,Politics
민주당  외국여행 좋아하는      억 기네스북감 혈세 낭비 ,Politics
 뉴스포커스  오늘 강서구청장 선거 국정감사 첫날부터 신경전,Politics
 김동연 슈퍼통장  출시 저축과 대출 한통장 해결,Politics
 년 만에   대  이    대   됐다 국민평형도 제낀 이 아파트,Economic
쿠팡  대만 진출  년 만에 수출     만    곳 돌파,Economic
 김대호의 경제읽기  삼성전자   분기 영업익    조 반도체  바닥 돌파  ,Economic
 연     치솟는 주담대 금리에  매물 쌓이는 서울,Economic
 단독  현대카드의 애플페이  일반카드 대비       적자 ,Economic
 반도체 바닥 찍었다  삼성전자 질주에   만전자  기대 모락모락,Economic
메리츠    본부 임직원  조직적 부정거래로 수십억 사익,Economic
 역시 머슴도 대감집에서   삼성전자   세계 최고의 직장   위,Economic
     만원 넣으면 월    만원 드려요  노년층 타깃 유사수신업체 기승,Economic
 반토막  난 한국 경상수지 희미한 호재 속 고유가 복병,Economic
대규모 반도체 적자에도   삼성전자  희망의 신호탄  쐈다,Economic
  인  역  최태원 회장의 광폭 행보 재계 넘어  사회적 리더 로 우뚝,Economic
 분기  어닝 서프라이즈  삼성전자   전자 실적 개선   경기 반등  청신호 ,Economic
물속     냄새까지 맡고  왈왈   실종자  명 찾아낸 수난탐지견,Economic
밀리의서재 직원  인당     억 대박  스톡옵션으로       수익,Economic
가격 반토막으로  뚝    킹크랩 먹기  지금이 기회   지금이뉴스 ,Economic
 단독  먹태깡 이어  품귀 원조  허니버터칩 콰트로치즈맛 나온다,Economic
     국감  김주현     년 주담대  문제 있었다   특례보금자리론은 다른 성격 ,Economic
코인으로 전비 조달하던 하마스  이스라엘 경찰에  덜미 ,Economic
금융위원장  은행권    년 만기 주담대  비상식적 정책 모순 아냐 ,Economic
