titles,category
천하람  윤핵관 서울 올라와야 제일 좋은 분은 장제원 ,Politics
 단독      일 밤 탈북민    여명 북송   군사작전 하듯  곳서 동시에,Politics
천하람  홍준표  마음에 안 들면 다 배신자  박근혜를 향단이라 해놓고 ,Politics
장경태  소셜뉴스 최대 주주는 김행 후보자 딸 ,Politics
환경부 장관    오염수 우리 영향 미미  자신 있냐  질문에  네 ,Politics
양평고속도로 노선 변경시  환경성 정책성  하락  원희룡 장관 답변은,Politics
한동훈  인사검증 문제에  성공한 사람들 대개 비슷한 문제 나오게 돼 있다 ,Politics
홍준표 저격한 하태경   당사아생  길 선택한 사람 누구였나 ,Politics
      억 원  합참 이전   감감무소식 인 이유는,Politics
 자막뉴스  한국    억 날릴 판   러시아 전쟁  불똥 ,Politics
 논란 키워 말아   선관위 해킹 가능  발표에  주판알  튕기는  ,Politics
 질병청  원전수 보고서 숨기곤 말도 안 되는 소리만 늘어놔  질타,Politics
 뉴스초점  강서구청장 보궐선거 국회선 이틀째 국정감사,Politics
김영호       군사합의  정찰자산 운용 과도하게 막아 ,Politics
여  박범계 출장비 축소 의혹  제기 박  축소 이유 없어  국감초점 ,Politics
 민병덕  대출 부당 가산금리  왜 기존 대출에선 안 빼나 ,Politics
 뉴스앤이슈  강서구청장 재보궐 선거         국민의힘 민주당 누가 웃을까 ,Politics
 년형 선고  서대문형무소에 수감,Politics
민주  모순된 정책 때문 가계부채 실패  사과해야  김주현  모순 아냐 ,Politics
송영길     번 넘는 압수수색 더는 당하지 않겠다  규탄 농성 선전포고,Politics
복지위 국감 여  문케어로 건보재정 악화     야  의대 정원 늘려야 ,Politics
교육위 국정감사에서  김건희 논문  증인 불참 논란 야  동행 명령장 발부해야 ,Politics
신원식  대화력전 전면 재검토  단시간 내 적 장사정포 궤멸시켜야 ,Politics
     개표조작 불가  선관위 헛말  민주당 대역 음모냐 선거제 바꿔야 할수도 ,Politics
한국인 여행객    명 귀국  현지 공항에 사람 몰려 ,Politics
일본 원전 오염수 방류에 분노한 시민  국민의힘 시의원에  친일파 놈들아  책임져라  일갈,Politics
군 가혹행위    명 입건됐는데 실형은  명   명 중  명은 해군,Politics
박민식  정율성 기념사업 즉각 중단 안하면 시정명령 발동  종합 ,Politics
국회 교육위   김건희 논문 표절  증인 불출석에 감사 일시 중단,Politics
 자객 공천론  하태경   마포을 정청래 잡으란 얘기 많아 ,Politics
 미니총선  두 자릿수 득표차땐  여야 당 대표 둘 중 하나는  치명상 ,Politics
국힘  민주당 정권  선관위 해킹  방치 발본색원해야 ,Politics
이스라엘서 돌아온 여행객들  무사귀국 다행  교민들은 무서워서 집 밖 못 나와 ,Politics
민주당  법무부  인사정보관리단 검증 부실  한동훈  판단은 대통령실 ,Politics
강서구청장 선거    데이    여야 투표율 촉각,Politics
국방장관  대화력전 전면 재검토 단시간 내   장사정포 궤멸시켜야 ,Politics
   신원식 유인촌 임명장 수여  김행은 여전히 고심 중,Politics
민주당  마리 앙투아네트  빵 대신 케이크 상황 오버랩    대통령 순방 예산 증가 비판,Politics
 무등의 아침  이준석  보궐선거는   정부  년 차 평가 김태우 후보 당선보다 득표율이 관심 ,Politics
진성준  강서 지면 여야 지도부 책임져야 김기현도 같은 처지 ,Politics
코스피  삼성전자  깜짝 실적   국채 진정에    급등 투자    ,Economic
 역시 드라마는 반전드라마  물린   엔솔 주주들  탈출 기회 잡을까  투자    ,Economic
  엔솔 배터리 판매량         위  기업 추격  속도 ,Economic
 이 팔 전쟁  암초 만난 경상수지  회복 흐름 이어갈까,Economic
급증하는 가계대출 제동 걸리나  시중은행  대출금리 인상 시작,Economic
정무위 국감장에 공매도 논란  김주현  기관 투자자 유리하지 않아 ,Economic
  월 코스닥 상장 유진테크놀로지  금형 기술로 전기차 시장 동반 성장할 것  투자    ,Economic
경총  월급 웃도는 실업급여 취업 의지 꺾는다 ,Economic
최태원  승계 계획 준비 화웨이폰에    칩 탑재  미스터리  ,Economic
 오염수 희석 방류  국제적인 방식   국감 달군  후쿠시마 논란 ,Economic
  현대   호위함 입찰 무효 가처분 기각에  방위산업에 부정적 영향 ,Economic
이오플로우   법원 판매금지 가처분   적극적 대응 전략 수립 중 ,Economic
두나무 자회사 잇단 수장 교체 람다    대표에 레벨스 전    ,Economic
  국민 신한 우리 대출 금리 올린다 이자 인상 도미노,Economic
김장철 다가오는데 절임 배추 가격 한 박스  만 원대  물가 비상 ,Economic
김주현    년 주담대  상식 안 맞아 지적 부동산 정책 모순 아냐 ,Economic
수상한  정비업체들  허위견적서로 보험금    억원 챙겼다,Economic
 이스라엘 전쟁에   방산주 계속 상승할 것 ,Economic
    리서치 부국장  이 팔 전쟁으로 인플레 높아질 위험  주시,Economic
 메리츠증권 직원들  가족 동원해 수십억 사익 챙겨   권영훈의 증시뉴스      ,Economic
 가계부채  대책 지적 빗발에 김주현 위원장  정책 모순 아니다  종합 ,Economic
에디슨 품은     결국 초소형 전기차 외면했다,Economic
올해 삼성전자 시총   조원  에코프로는  배 뛰어 투자    ,Economic
유광점퍼 입고 등장할까    구광모 회장  한국시리즈 참석 전망  김익환의 컴퍼니워치 ,Economic
 년 만에   대  이    대   됐다 국민평형도 제낀 이 아파트,Economic
쿠팡  대만 진출  년 만에 수출     만    곳 돌파,Economic
 김대호의 경제읽기  삼성전자   분기 영업익    조 반도체  바닥 돌파  ,Economic
 연     치솟는 주담대 금리에  매물 쌓이는 서울,Economic
 단독  현대카드의 애플페이  일반카드 대비       적자 ,Economic
 반도체 바닥 찍었다  삼성전자 질주에   만전자  기대 모락모락,Economic
메리츠    본부 임직원  조직적 부정거래로 수십억 사익,Economic
 역시 머슴도 대감집에서   삼성전자   세계 최고의 직장   위,Economic
     만원 넣으면 월    만원 드려요  노년층 타깃 유사수신업체 기승,Economic
 반토막  난 한국 경상수지 희미한 호재 속 고유가 복병,Economic
대규모 반도체 적자에도   삼성전자  희망의 신호탄  쐈다,Economic
  인  역  최태원 회장의 광폭 행보 재계 넘어  사회적 리더 로 우뚝,Economic
 분기  어닝 서프라이즈  삼성전자   전자 실적 개선   경기 반등  청신호 ,Economic
물속     냄새까지 맡고  왈왈   실종자  명 찾아낸 수난탐지견,Economic
밀리의서재 직원  인당     억 대박  스톡옵션으로       수익,Economic
가격 반토막으로  뚝    킹크랩 먹기  지금이 기회   지금이뉴스 ,Economic
