titles,category
보트 위에서 냄새 맡다  왈   수난탐지견 파도 규리  실종자 또 찾았다,Social
 조폭 저격  유튜버  너클 낀 일당에 피습 알고보니 안양 조폭 신입,Social
대학병원 인턴  마취환자 성추행 사건  대법원으로,Social
대구  신청사 건립사업에  부지매각  방침 재확인 여론조사 결과 발표,Social
   규탄 농성  송영길   개월 동안 압수수색    번 소환도 못해 ,Social
보훈부  정율성 사업  중단 권고에 광주시  위법 사항 없어 ,Social
 등급으로 넓혀 경쟁 완화  결국 수능이 이겼다,Social
 서울대병원 파업  첫 날      명 참가  응급실 등 유지  종합 ,Social
길가던   대 치어 숨지게 한 뺑소니  승용차 운전자  검거,Social
일산차병원  로봇수술      례 달성,Social
법무부   한국형 제시카법  입법 추진  고위험 성범죄자 거주 제한한다,Social
 조직폭력배 저격  유튜버 폭행한 일당 알고봤더니 안양지역 조폭,Social
부대 행사 사라지고 상영작도 줄었다      규모 축소 현실로,Social
조폭 저격 유튜버 결국 보복당했다 너클 끼고 폭행,Social
방영환 택시 노동자 분신 노조 유가족  완전월급제 투쟁할 것 ,Social
닭장에 갇힌 이스라엘 어린이   전쟁 전 촬영  거짓 영상   오마이팩트 ,Social
천안 안서동 대학로  청사진 나왔다,Social
임실군  치즈축제 옥정호 등 인기 관광객 역대 최대 기록,Social
 이 팔 전쟁  둘로 갈라진 지구촌 곳곳서 맞불 시위,Social
 프듀   위  김지성  미코에선  등 올랐다   위 했던 동생은 탈락,Social
돈 벌려고 분양받은 개   마리 영하   도 산에 버린   대,Social
피프티 소속사 대표       그것이알고싶다 서 인터뷰한 관계자 고소,Social
시흥 복합물류센터 신축 현장서    이테크건설 하청업체 소속   대 근로자 사망,Social
 수사권 조정  년 개월  검찰 보완수사 요구     만건 해마다 증가,Social
누렇게 변한 야생생물 보호구역    주민들 제초제 살포 때문 ,Social
 너클  끼고  조폭 저격  유튜버 폭행  안양 조폭 검거,Social
 미화원 채용 알선  수억원 받은 광주 지자체 노조위원장 구속기소,Social
지하철      호선 노후 전동차 새 전동차로    칸 교체,Social
피프티 소속사 어트랙트   그알  내부관계자 인터뷰이 허위사실 적시 명예훼손으로 고소,Social
율동으로   년치 월급  여성 너도나도  라방 ,Social
경북대병원 파업 첫날  어수선  환자들 하염없이  대기 중 ,Social
 수의사 남친 에 임신사실 알리자  사실 유부남 ,Social
이균용 낙마에 김영훈 변협회장  대법원장 후보 공개추천 ,Social
 분 지각했다고 고  학생 뺨 때리고 목 조른 교사,Social
 땜질식 처방 안 돼  농어촌특별세 폐지되면  조    억원 사라져,Social
직장 어린이집 설치 의무 어긴 기업 서울에   개  제로 로 만든다,Social
지하철 개찰구 통과 때  어르신 건강하세요    어르신들 뿔났다,Social
교통혼잡 유발 건물에 세금    억원 부과된 시설 어디 ,Social
피 흘리는 아내 방치하고 테니스 치러간   대 남편  유기죄만 적용,Social
임신했다는 말에  내 아이 맞아  아내가 곧 출산한다 는 수의사 남친,Social
 대선 허위 녹취록  정황 포착 김병욱 의원 보좌관 기자 압수수색 종합 ,Social
최용규 변호사  총선출마 회견  포항 더 큰 미래 열겠다 ,Social
부산세관  담배   만갑 밀수출 조직 적발 대상국과 가격 차    배,Social
 임영웅 표 팝니다    년생 민증에 속은    명      만원 뜯겼다,Social
검찰  이정근 선거법 위반 혐의 징역  년 개월 구형,Social
  활어차 부산항 입항은 매년 증가   방사능 검사 차량은  대 중  대,Social
음주운전 적발된 몽골 외교관  면책특권으로 처벌 피해,Social
해경  백령도 불법조업 중국어선  척 나포      척 퇴거 조치,Social
서울대병원 노조  무기한 파업 돌입  검사 언제 할 수 있을지  진료 차질,Social
 단독  업무협의  위해 금감원 출입하는 대형 로펌 변호사들 투명성 제고 목소리,Social
 쪼개기 후원  구현모     대표  횡령  심 벌금    만원,Social
조규홍 복지장관      년 의대 증원 노력 공공의대 설립엔 신중 ,Social
검찰  대선보도  명예훼손 혐의 기자 야당 의원 보좌관 압수수색,Social
쓰레기 줍다 심장멎은   대 공공근로자 긴박한 응급처치로 소생,Social
 단독  최근    년간 교원 추락사  명     원인 밝혀내야 ,Social
 학폭 피해 폭로  표예림  극단 선택 전 경찰 조사 앞둬,Social
후임에  겨털  먹인 해병대 예비역 벌금    만원,Social
양육비 안 주는  나쁜 아빠  첫 형사재판 열려  검찰  징역  개월 구형,Social
 지각했다 는 이유로 교사가 학생 목 조르고 뺨 때려 전치  주  혐의 인정 ,Social
 대강 정책 두고     행정 폭거         소모적 논쟁 그만      국감 ,Social
 지각했다 는 이유로 교사가 학생 목 조르고 뺨 때려 전치  주  혐의 인정 ,Social
 임금체불  분신 택시기사 유족  월급제 도입  책임자 처벌해야 ,Social
 더 글로리  현실판 주인공  숨진 채 발견 유튜버와 고소전,Social
수원 전세사기 피해 확산   명    억 규모,Social
대구시민 다수  대책없는 신청사 이전 원치않아 ,Social
의정부 호원초 교사 유족  학부모  명 고소,Social
 떡볶이에 머리카락  사장님만 보이게 올린 사진 리뷰  숨은 사연은 ,Social
 단독  경찰도 환호했다는 그 기술  치매 실종자      수색   가 대신한다,Social
피해 신고만    건  수원 전세사기  집중 지역에 현수막 건다,Social
 쪼개기 후원  구현모 전    대표에 벌금    만원 추가,Social
들불처럼 번지는  가을 독감  학원가에 다시 등장한  일회용 마스크 ,Social
음료 들고 버스 타려다 거절당하자 길바닥에 던진 승객 논란,Social
실적 시즌 온다  분기 제약바이오 호실적 기대,Social
소아 환자 봐줄 응급실 부족 도착해도 문전박대   분뉴스 ,Social
외국산을 국산으로  돼지고기  년간 속여 판 식당 주인,Social
좌회전  킥보드 여학생  피하다 트럭 전복 여학생은 도망 공분 영상 ,Social
대구시  시민     시청 신청사 건립 보류 의견  여론조사 결과,Social
이원석 검찰총장  교사 정당한 지도는 아동학대 아냐 ,Social
한동훈  인사정보관리단  기계적 자료 수집만 판단은 대통령실 ,Social
   년 전 부마민주항쟁의 기록을 찾습니다 ,Social
부마민주항쟁 때 물고문 보상금 받았어도  정신적 손배소  가능하다,Social
웅진씽크빅 그림책  친구의 전설   가족 뮤지컬로 재탄생한다,Social
 수원 전세사기 의혹  피해 신고    건 하루 새   건 늘어 종합 ,Social
빚내 신청사 건립 안돼 시민 여론 재정 대책없는 신청사 건립 압도적 반대,Social
모텔서 신생아 창밖으로 던져 살해한   대 친모 구속 기로,Social
담배 사주고 청소년에  스타킹 달라  나쁜 어른들 무더기 적발,Social
 전세사기 깡통전세 피해자      정부 대책 도움 못 받아 ,Social
 잘 지내니  헤어진 연인에    차례 문자 보낸   대  구속 ,Social
한동훈  인사검증 질의에  법무부는 기계적으로 자료 수집 ,Social
혼자 귀가하는 아동 노린   대 최후 과거에도 성범죄 전력  ,Social
성인 남성이 여고생에  술 담배 사줄 테니 신던 스타킹 달라 ,Social
검찰   위증 혐의  전북대 이귀재 교수 자택 등 압수수색,Social
변협  대법원장 후보 공개 추천 재개   일 명단 발표 ,Social
 김건희 논문  의혹 증인  명 다 불출석     동행명령 발부해야 ,Social
불법촬영 매년     건 관악구 모텔 카메라에 찍힌 피해자    명,Social
    년 그대로인 의대 정원 보건복지부      년에 확대 ,Social
 늦잠 잤습니다  뭐가 잘못됐나요   학생은  분 늦었고  교사는 뺨을 때렸다,Social
 결국 뇌사  쓰러진 아내 두고 테니스 치러 간 남편 유기죄만 적용,Social
보훈부  정율성 사업  중단 권고   광주  위법 없다  거부,Social
     만원 영어유치원  다음은   세 고시 에 내몰린다,Social
무단횡단 보행자 치어 숨지게 한 운전자  명 무죄 이유는 ,Social
민주당 원주을 지역위원회  아카데미극장 갈등 해결 촉구 성명,Social
 청주가 캠핑 성지로  코베아  축구장   개 크기 명품 캠핑장 만든다,Social
국내산 돼지라던 무한리필 식당 수입산 섞었다,Social
옥순은 영숙을  명예훼손 으로 고소할 수 있을까 궁즉답 ,Social
대구 시민   명 중  명  유휴부지 매각해 신청사 재원 마련 ,Social
질병청  코로나   위기 단계  주의 로 하향 시점 연내 결정 ,Social
국제결혼 베트남   아들과 중앙선 침범 차량에 참변,Social
 남들  년 번 돈 하루에 다 써  손녀 돈자랑에 부정축재 들킨   퇴직간부,Social
외국산 돼지 국내산으로 속여 판 무한리필식당 사장 구속영장,Social
 난 잘못 없다   극단선택  표예림이 지목한 유튜버  입장문 보니,Social
백령도 인근 해상서     침범해 불법조업 해경  중국어선  척 나포,Social
 단독  불량 의사  실형 받고도 진료 면허 뺏는데    일 걸린다,Social
킥보드 피하던 트럭  끼익  쾅   그냥 가려다  어디가   소리에 ,Social
 르포   폭격 중단하라   광화문에 모인  팔레스타인 지지자들 ,Social
수난탐지견 파도 규리  남한강서 실종된   대 남성 찾았다,Social
 늦잠 잤다 는 말에 격분  분 늦은 학생 목 조르고 폭행한 교사,Social
 단독   년 전엔 난리치더니  학대 아동 보호  약속 안지키는 정부,Social
서울억새축제   일 시작 하늘공원  일간 야간 개방,Social
여고생 킥보드 피하려다 트럭 전복 학생은 그냥 가려 했다  영상 ,Social
부산 교차로서    트럭 승용차와 충돌 후 전도  명 경상,Social
한동훈  인사검증 부실 지적에  기계적 자료 수집만   판단 안해 ,Social
경남 단감 주산지 농민들 울상 탄저병 확산에 생산량  뚝 ,Social
 피프티  소속사 대표   그알 서 인터뷰한 관계자 고소,Social
 지그재그 음주운전  몽골대사관 외교관 적발   음주측정 거부,Social
헤어진 연인 폭행 말리던 아들 살해한   대 징역   년,Social
겸직금지 어기고 수억원 번 유명 유튜버  잘 몰랐다 ,Social
 이탄희  비리 경제인 사면 참담  한동훈  대통령 정치적 결단 ,Social
해양진흥공사      지분매각에 산은과 입장차 없다 ,Social
 보궐선거  강서구청장 오후  시 합산투표율       직전 지선보다 낮아,Social
안성 물류센터 신축 공사장서   대 작업자 추락해 숨져,Social
 제주대에    억 쾌척  재일제주인 사업가 김창인 회장 별세,Social
법원  학생연구원 인건비  억 빼돌린 경북대 교수 보석 허가,Social
육군   보병사단  백룡     완전작전  유공자 격려 행사 실시,Social
 뉴 리폿   마지막 비행기  소문 돌았다 이스라엘 여행객    명 귀국,Social
영어유치원비 월평균    만원  세종이  위,Social
 음주 후 난폭운전  몽골대사관 외교관 붙잡히자  면책특권 ,Social
교육감님과 교육계에 드리는 호소 유보통합을 말하다 ,Social
      국감 한동훈  법무부는 인사 자료 수집 역할만  가부 판단 안해 ,Social
사건 브로커에 돈 받고 수사 정보 알려준 검찰 수사관 강제수사,Social
여고생에 술 담배 대리구매 신던 스타킹 요구한  ,Social
 금메달 주역     축구 국대들이 압구정 클럽에  영상 퍼져,Social
이스라엘서    명 귀국  훈련인 줄 알았다 ,Social
스토킹 피해 호소했던 표예림  지목된 유튜버  잘못 없다 ,Social
  표예림씨  극단 선택 전 무더기 고소 당했었다,Social
 수수료 로 신던 스타킹 양말 달라  청소년 술담배  댈구 한 나쁜 어른들,Social
검찰   선거법 위반  이정근에 징역  년  개월 구형,Social
과학 유튜버 궤도  겸직금지 규정 어겨 정직 처분,Social
    대선 허위보도 의혹  민주당 김병욱 의원실 보좌관 등 압수수색,Social
 단독  질병청   오염수 보고서 공개  전문가 의견 뭉갰다,Social
 이시각헤드라인    월   일 뉴스현장,Social
 와주라  공정방송     지켜주라        시민주주운동 시작,Social
임신 알렸더니 수의사 남친  내 애 맞아  사실 나 유부남  돌변,Social
      국감 코로나   위기단계 경계 주의 하향 시점  연내 결정,Social
극단적 선택 표예림씨  폭로 후 고소만  건 당해,Social
 사람이 먼저인데 규정 어기는 개플루언서  짜증  승무원 고충 견주  허위  반박,Social
코로나  경계 에서  주의 로 하향  질병청  올해 안에 결정,Social
연인 폭행 말리던  살 아들 살해 후 납치 강간까지 시도한   대 ,Social
제주 유명 식당 대표 살해 주범   공범에 항소심 사형 구형,Social
 단독 김행  또 거짓해명   잘 모른다 던 기업 이끌며 넥서스투자서 수억원 유치,Social
극단적 선택 표예림씨  폭로 후 고소만  건 당해,Social
 사람이 먼저인데 규정 어기는 개플루언서  짜증  승무원 고충 견주  허위  반박,Social
코로나  경계 에서  주의 로 하향  질병청  올해 안에 결정,Social
연인 폭행 말리던  살 아들 살해 후 납치 강간까지 시도한   대 ,Social
제주 유명 식당 대표 살해 주범   공범에 항소심 사형 구형,Social
 단독 김행  또 거짓해명   잘 모른다 던 기업 이끌며 넥서스투자서 수억원 유치,Social
 천장 뜯었더니 고인 물이 우수수    년 된 정부서울청사 누수,Social
표예림 극단 선택 사망 촉법나이트  끝까지 가해자들 추적해 지옥 보낼 것 ,Social
검찰   대선 가짜뉴스  연결고리 찾았나,Social
 늦잠 잤습니다    분 지각한 학생  목 조르고 뺨 때린 교사,Social
온라인 도박 늪 빠진 청소년 상담 줄줄이    중독 괜찮을까 ,Social
  정부 통계조작 의혹  표본조사 설계 통계청 직원 참고인 조사,Social
 김동연표 슈퍼통장  경기청년  만명에 저리 대출  저축시 우대금리,Social
박범계   출장비 축소 논란에  심심한 유감    축소할 이유 없어 ,Social
음주운전 차량에 손수레 끌던   대 여성 치여 숨져,Social
 음주운전 의심  몽골 외교관  면책특권으로 처벌 불가 사건 종결,Social
한화진 환경 장관   라돈 침대  지자체와 분산 매립 협의 중 ,Social
전세사기 피해자  명 중  명  막다른 골목 ,Social
 장애 영아 살해  혐의 친부모 외조모  첫 재판서 혐의 부인,Social
 단독  비대면진료 초진 장애인 환자  시범사업 한달 만에     줄었다,Social
